{
  "schemaVersion": 2,
  "task": "SEC-03",
  "state": "governance-ready-runtime-receipts-required",
  "architecture": {
    "exactCasePath": "parity/SEC-03-EXECUTION-ISOLATION-ARCHITECTURE.md",
    "sha256": "1985ef61f9de682bfd04b60eba2f7cc9a44f4541394f04d08f826ff2356737fe"
  },
  "attackMatrix": {
    "exactCasePath": "tests/sec03-attack-matrix.json",
    "sha256": "a5989920de885a51dcf07c83988ee80c33134d58abb58390391af8560da50eac",
    "realHostFamilyIds": [
      "A01",
      "A02",
      "A03",
      "A04",
      "A05",
      "A06",
      "A07",
      "A08",
      "A09",
      "A10",
      "A11",
      "A12",
      "A13",
      "A14",
      "A15",
      "A16",
      "A17",
      "A18",
      "A19"
    ],
    "runtimeReceiptCount": 482
  },
  "predecessor": {
    "taskId": "SEC-02",
    "exactCasePath": "tests/manifests/sec-02-resolved.json",
    "fileSha256": "a788157aeb96cf6a4ca4ac6878eb902207df4aeffad2b537a782930a98961b5a",
    "canonicalPayloadSha256": "e1826c3c47342813095569432326640b2fc88854163c54ced8aba7244adc7108"
  },
  "sourceManifest": {
    "taskId": "SEC-03",
    "exactCasePath": "tests/manifests/sec-03.json",
    "sha256": "190a892e73ecd18e1eab65ba02e49bd3013eb2b64171cc9336828355e2858cfb"
  },
  "deltaEntries": [
    {
      "exactCasePath": "electron/main.cjs",
      "sha256": "66eec398d4c51529e40a54b189c4961de2e7c40f22eab215d2e1cc4e336fc27a",
      "kind": "runtime",
      "layer": null,
      "owner": "SEC-03",
      "testCaseIds": [],
      "supersedes": {
        "owner": "SEC-02",
        "sha256": "e1826c3c47342813095569432326640b2fc88854163c54ced8aba7244adc7108",
        "hashScope": "predecessor-manifest"
      }
    },
    {
      "exactCasePath": "electron/preload.cjs",
      "sha256": "e201976c91539242837cad4e7fd5e35c656258aca95643955ac8c58720944b14",
      "kind": "runtime",
      "layer": null,
      "owner": "SEC-03",
      "testCaseIds": [],
      "supersedes": {
        "owner": "SEC-02",
        "sha256": "e1826c3c47342813095569432326640b2fc88854163c54ced8aba7244adc7108",
        "hashScope": "predecessor-manifest"
      }
    },
    {
      "exactCasePath": "electron/user-data-migration.cjs",
      "sha256": "9c9e51e2b5b6bb8123c73a449ebed0c20de8830779e646e46b6ebdff4c53e4c4",
      "kind": "runtime",
      "layer": null,
      "owner": "SEC-03",
      "testCaseIds": [],
      "supersedes": null
    },
    {
      "exactCasePath": "src/agent.ts",
      "sha256": "5872990a26002684f02aa60b4cc35e1c64076df91c5b0f772ced34d3252e41f5",
      "kind": "runtime",
      "layer": null,
      "owner": "SEC-03",
      "testCaseIds": [],
      "supersedes": {
        "owner": "SEC-02",
        "sha256": "e1826c3c47342813095569432326640b2fc88854163c54ced8aba7244adc7108",
        "hashScope": "predecessor-manifest"
      }
    },
    {
      "exactCasePath": "src/capability-broker.ts",
      "sha256": "a36f7031be1aa04c0921a6d4766a1e4392fca68fb4bbf094b320553b186bb13b",
      "kind": "runtime",
      "layer": null,
      "owner": "SEC-03",
      "testCaseIds": [],
      "supersedes": {
        "owner": "SEC-02",
        "sha256": "e1826c3c47342813095569432326640b2fc88854163c54ced8aba7244adc7108",
        "hashScope": "predecessor-manifest"
      }
    },
    {
      "exactCasePath": "src/execution-isolation.ts",
      "sha256": "83dfdf6e98865acce425a66e8eb0bd4cded8425f2f7e2854334db4c730a28f00",
      "kind": "runtime",
      "layer": null,
      "owner": "SEC-03",
      "testCaseIds": [],
      "supersedes": null
    },
    {
      "exactCasePath": "src/execution-network-broker.ts",
      "sha256": "cb582c35d0d9cecde47439a95d90f9ece2c28408f33ab3bb446c415183ff39c6",
      "kind": "runtime",
      "layer": null,
      "owner": "SEC-03",
      "testCaseIds": [],
      "supersedes": null
    },
    {
      "exactCasePath": "src/execution-native.ts",
      "sha256": "4fa8d7600bb79b86e4741aa8952ea4231ce9b6251a553d00c318ea6b97bfcf33",
      "kind": "runtime",
      "layer": null,
      "owner": "SEC-03",
      "testCaseIds": [],
      "supersedes": null
    },
    {
      "exactCasePath": "src/execution-runtime.ts",
      "sha256": "0264db73364b929b7a3e9de95093798b303cdb6bc81d301b8bfd327f6944e676",
      "kind": "runtime",
      "layer": null,
      "owner": "SEC-03",
      "testCaseIds": [],
      "supersedes": null
    },
    {
      "exactCasePath": "src/manual-execution-consent.ts",
      "sha256": "b1e108580eeefcc4c14451f9965e7fbcb1d79c2348152fd44e024b8df992fa4a",
      "kind": "runtime",
      "layer": null,
      "owner": "SEC-03",
      "testCaseIds": [],
      "supersedes": null
    },
    {
      "exactCasePath": "src/native-process-consent.ts",
      "sha256": "6a169d179baab400e8cc8719b5d700a97faef436e7f9cd0756a5e66bdec386d3",
      "kind": "runtime",
      "layer": null,
      "owner": "SEC-03",
      "testCaseIds": [],
      "supersedes": null
    },
    {
      "exactCasePath": "src/native-process-consent-transport.ts",
      "sha256": "ea7a50e51a402226298e79e44ca7c82a5da1e8ec5de1e05834230eb95bc7a723",
      "kind": "runtime",
      "layer": null,
      "owner": "SEC-03",
      "testCaseIds": [],
      "supersedes": null
    },
    {
      "exactCasePath": "src/index.ts",
      "sha256": "66e6dc01044271f687f58748a1bfcdc765539292b1be78cca65fdcc924463e15",
      "kind": "runtime",
      "layer": null,
      "owner": "SEC-03",
      "testCaseIds": [],
      "supersedes": {
        "owner": "SEC-02",
        "sha256": "e1826c3c47342813095569432326640b2fc88854163c54ced8aba7244adc7108",
        "hashScope": "predecessor-manifest"
      }
    },
    {
      "exactCasePath": "src/path-policy.ts",
      "sha256": "b8989794132a5ef73a037b11ba781df64d819cbeaa3791898af86d4b616a6ff0",
      "kind": "runtime",
      "layer": null,
      "owner": "SEC-03",
      "testCaseIds": [],
      "supersedes": {
        "owner": "SEC-02",
        "sha256": "e1826c3c47342813095569432326640b2fc88854163c54ced8aba7244adc7108",
        "hashScope": "predecessor-manifest"
      }
    },
    {
      "exactCasePath": "src/terminal.ts",
      "sha256": "080e0e9f8820fb1c704041fbf70ee59c93f44c860c50ab8d7fe2d68669ca6980",
      "kind": "runtime",
      "layer": null,
      "owner": "SEC-03",
      "testCaseIds": [],
      "supersedes": {
        "owner": "SEC-02",
        "sha256": "e1826c3c47342813095569432326640b2fc88854163c54ced8aba7244adc7108",
        "hashScope": "predecessor-manifest"
      }
    },
    {
      "exactCasePath": "src/tool-policies.ts",
      "sha256": "45fcc2cf22b2000176e164c6d86c1ff9338fcc299282d4fdd0aef218bfc1bb62",
      "kind": "runtime",
      "layer": null,
      "owner": "SEC-03",
      "testCaseIds": [],
      "supersedes": {
        "owner": "SEC-02",
        "sha256": "e1826c3c47342813095569432326640b2fc88854163c54ced8aba7244adc7108",
        "hashScope": "predecessor-manifest"
      }
    },
    {
      "exactCasePath": "src/types.ts",
      "sha256": "b8b3832dbcac45658a63bb020a86ac40fcaab42b010bd829ddd867f3c8fb3b4a",
      "kind": "runtime",
      "layer": null,
      "owner": "SEC-03",
      "testCaseIds": [],
      "supersedes": {
        "owner": "SEC-02",
        "sha256": "e1826c3c47342813095569432326640b2fc88854163c54ced8aba7244adc7108",
        "hashScope": "predecessor-manifest"
      }
    },
    {
      "exactCasePath": "dist/agent.js",
      "sha256": "478c9f9fed363353c12cddabb788fe85c60448d50dff27fb6a6697683ad6d7ba",
      "kind": "runtime",
      "layer": null,
      "owner": "SEC-03",
      "testCaseIds": [],
      "supersedes": null
    },
    {
      "exactCasePath": "dist/capability-broker.js",
      "sha256": "f8d2d4815bfddd55d045593c35f4dc6567bbdda47d8b2486cbd41196363bd79d",
      "kind": "runtime",
      "layer": null,
      "owner": "SEC-03",
      "testCaseIds": [],
      "supersedes": {
        "owner": "SEC-02",
        "sha256": "e1826c3c47342813095569432326640b2fc88854163c54ced8aba7244adc7108",
        "hashScope": "predecessor-manifest"
      }
    },
    {
      "exactCasePath": "dist/execution-isolation.js",
      "sha256": "b52727fa9a2a8da7e7746ccdec0bc38b9e714abf4f5baf4cd48f0f1d15653c80",
      "kind": "runtime",
      "layer": null,
      "owner": "SEC-03",
      "testCaseIds": [],
      "supersedes": null
    },
    {
      "exactCasePath": "dist/execution-network-broker.js",
      "sha256": "3845ac9f7af757f05b9013e38a59fbd7bf1575cdf176fde0c808dfd9623439fc",
      "kind": "runtime",
      "layer": null,
      "owner": "SEC-03",
      "testCaseIds": [],
      "supersedes": null
    },
    {
      "exactCasePath": "dist/execution-native.js",
      "sha256": "193872b2ee7c444763a9c796f1e1b6aaf67d1c7df8ada66632007bc99f330356",
      "kind": "runtime",
      "layer": null,
      "owner": "SEC-03",
      "testCaseIds": [],
      "supersedes": null
    },
    {
      "exactCasePath": "dist/execution-runtime.js",
      "sha256": "8e5d9a42b00f8694de26a015c77f6131ba71100e1de8ec39dca4341d6112a1de",
      "kind": "runtime",
      "layer": null,
      "owner": "SEC-03",
      "testCaseIds": [],
      "supersedes": null
    },
    {
      "exactCasePath": "dist/manual-execution-consent.js",
      "sha256": "1e64ab14006ff60eee54a57064c3a72213cfd6b01359d59a8fddb0c89d6862a8",
      "kind": "runtime",
      "layer": null,
      "owner": "SEC-03",
      "testCaseIds": [],
      "supersedes": null
    },
    {
      "exactCasePath": "dist/native-process-consent.js",
      "sha256": "5709e3d996d64fda8478304ea3a2de754265d6cc2e79a6dd45f66b13ef6b4379",
      "kind": "runtime",
      "layer": null,
      "owner": "SEC-03",
      "testCaseIds": [],
      "supersedes": null
    },
    {
      "exactCasePath": "dist/native-process-consent-transport.js",
      "sha256": "9a21bb25ecf496b24bb43184c02180425b8d96759f731819cfec66b1fa01b3a7",
      "kind": "runtime",
      "layer": null,
      "owner": "SEC-03",
      "testCaseIds": [],
      "supersedes": null
    },
    {
      "exactCasePath": "dist/index.js",